dados/X_teste.csv

linha_origem,area,perimetro,compacidade,comprimento,largura,assimetria,sulco
3,14.29,14.09,0.905,5.291,3.337,2.699,4.825
168,12.15,13.45,0.8443,5.417,2.837,3.638,5.338
138,15.57,15.15,0.8527,5.92,3.231,2.64,5.879
176,10.8,12.57,0.859,4.981,2.821,4.773,5.063
131,18.3,15.89,0.9108,5.979,3.755,2.837,5.962
142,13.32,13.94,0.8613,5.541,3.073,7.035,5.44
115,20.97,17.25,0.8859,6.563,3.991,4.677,6.316
52,15.78,14.91,0.8923,5.674,3.434,5.593,5.136
85,19.51,16.71,0.878,6.366,3.801,2.962,6.185
111,18.45,16.12,0.8921,6.107,3.769,2.235,5.794
24,12.08,13.23,0.8664,5.099,2.936,1.415,4.961
183,12.19,13.36,0.8579,5.24,2.909,4.857,5.158
130,17.55,15.66,0.8991,5.791,3.69,5.366,5.661
132,18.94,16.32,0.8942,6.144,3.825,2.908,5.949
172,11.55,13.1,0.8455,5.167,2.845,6.715,4.956
30,13.45,14.02,0.8604,5.516,3.065,3.531,5.097
169,11.35,13.12,0.8291,5.176,2.668,4.337,5.132
15,13.74,14.05,0.8744,5.482,3.114,2.932,4.825
191,10.93,12.8,0.839,5.046,2.717,5.398,5.045
44,15.5,14.86,0.882,5.877,3.396,4.711,5.528
53,14.49,14.61,0.8538,5.715,3.113,4.116,5.396
182,12.46,13.41,0.8706,5.236,3.017,4.987,5.147
123,16.17,15.38,0.8588,5.762,3.387,4.286,5.703
61,11.42,12.86,0.8683,5.008,2.85,2.7,4.607
95,18.36,16.52,0.8452,6.666,3.485,4.933,6.448
22,14.11,14.26,0.8722,5.52,3.168,2.688,5.219
62,11.23,12.63,0.884,4.902,2.879,2.269,4.703
66,12.88,13.5,0.8879,5.139,3.119,2.352,4.607
163,12.05,13.41,0.8416,5.267,2.847,4.988,5.046
21,14.16,14.4,0.8584,5.658,3.129,3.072,5.176
155,11.36,13.05,0.8382,5.175,2.755,4.048,5.263
99,18.17,16.26,0.8637,6.271,3.512,2.853,6.273
2,14.88,14.57,0.8811,5.554,3.333,1.018,4.956
147,11.43,13.13,0.8335,5.176,2.719,2.221,5.132
153,12.26,13.6,0.8333,5.408,2.833,4.756,5.36
110,18.55,16.22,0.8865,6.153,3.674,1.738,5.894
96,16.87,15.65,0.8648,6.139,3.463,3.696,5.967
94,18.59,16.05,0.9066,6.037,3.86,6.001,5.877
162,12.02,13.33,0.8503,5.35,2.81,4.271,5.308
38,17.08,15.38,0.9079,5.832,3.683,2.956,5.484
199,12.62,13.67,0.8481,5.41,2.911,3.306,5.231
118,19.15,16.45,0.889,6.245,3.815,3.084,6.185

entrega_27-11_seeds.md

### Linha 24: Kama classificada como Canadian

Caminho observado: sulco=4.961 <= 5.5755; area=12.08 <= 13.435; area=12.08 <= 12.71; sulco=4.961 > 4.675. Folha 5, com 48 exemplos de treino. Proporções de classes 1, 2, 3 nessa folha: [0.0, 0.0, 1.0].

### Linha 62: Kama classificada como Canadian

Caminho observado: sulco=4.703 <= 5.5755; area=11.23 <= 13.435; area=11.23 <= 12.71; sulco=4.703 > 4.675. Folha 5, com 48 exemplos de treino. Proporções de classes 1, 2, 3 nessa folha: [0.0, 0.0, 1.0].

### Linha 38: Kama classificada como Rosa

Caminho observado: sulco=5.484 <= 5.5755; area=17.08 > 13.435; largura=3.683 > 3.572. Folha 13, com 1 exemplos de treino. Proporções de classes 1, 2, 3 nessa folha: [0.0, 1.0, 0.0].